{
  "id": "beijing-air-data-clean-dispatch",
  "title": "北京空气质量数据清洁调度",
  "description": "移动数据巡检员，回收字段校验工单并避开口径漂移。",
  "duration_seconds": 45,
  "score_per_ticket": 10,
  "controls": ["方向键或 WASD 移动", "R 键或按钮重新开始"],
  "source": {
    "path": "dataset/06-beijing-air-quality-audit/case.csv",
    "sha256": "0055067502c1056beeb8de9f9de5aad357f267760b8a0df5fc303b2df3361108",
    "row_count": 21039,
    "fields_used_for_theme": ["station", "observed_at", "missing_pollutant_count", "data_nature"],
    "data_nature": "public-derived"
  },
  "tickets": ["缺失字段工单", "时间戳工单", "站点一致性工单"],
  "hazards": ["口径漂移", "未经核验的推断"],
  "health_boundary": "这是数据质量教学游戏，不表示实时空气质量，不提供健康建议。"
}
